{
  "requestId": "request-purpose-mismatch-001",
  "delegationId": "delegation-valid-001",
  "result": "DENY",
  "reasonCode": "PURPOSE_OUT_OF_SCOPE",
  "reason": "The requested purpose is outside the delegated scope.",
  "validatedAt": "2026-08-15T10:00:00Z",
  "validatorVersion": "aut-cisrc-profile-v0.1",
  "warnings": [],
  "checkedAt": [
    {
      "check": "delegation_present",
      "passed": true,
      "reasonCode": "ALLOW",
      "detail": "Delegation artefact is present."
    },
    {
      "check": "authority_chain_present",
      "passed": true,
      "reasonCode": "ALLOW",
      "detail": "Authority chain is present."
    },
    {
      "check": "actor_matches_delegate",
      "passed": true,
      "reasonCode": "ALLOW",
      "detail": "Request actor matches the named delegate."
    },
    {
      "check": "action_permitted",
      "passed": true,
      "reasonCode": "ALLOW",
      "detail": "Requested action is included in permittedActions."
    },
    {
      "check": "resource_in_scope",
      "passed": true,
      "reasonCode": "ALLOW",
      "detail": "Requested resource matches delegated resource."
    },
    {
      "check": "purpose_in_scope",
      "passed": false,
      "reasonCode": "PURPOSE_OUT_OF_SCOPE",
      "detail": "Requested purpose does not match delegated purpose."
    }
  ]
}
